{
  "$schema": "https://json-schema.org/draft/2020-12/schema",
  "$id": "https://github.com/martin10101/nyc-buildability/services/api/app/rules/schemas/v1/rule_definition.schema.json",
  "title": "Zoning Rule Definition (DSL v1)",
  "description": "v1 versioned JSON DSL for a single deterministic zoning rule (M4-T001, PRD section 11). Engine-owned contract; the architecture doc (docs/RULES_ENGINE_ARCHITECTURE.md) documents its promotion path into packages/contracts when a cross-tier consumer (UI/report) first needs it. Family-agnostic: a FAR rule, a yard rule, and a height rule are all expressed with the same shape and the same closed op set, so a structurally different family is representable with zero engine changes. 'status' may never be 'published' in an authored file - publication requires a recorded G6 qualified-human approval, never an agent.",
  "type": "object",
  "additionalProperties": false,
  "required": [
    "rule_id",
    "rule_version",
    "family",
    "title",
    "jurisdiction",
    "status",
    "description",
    "citations",
    "inputs",
    "outputs",
    "parameters",
    "applicability",
    "computation"
  ],
  "properties": {
    "rule_id": {"type": "string", "pattern": "^[a-z0-9][a-z0-9-]*$"},
    "rule_version": {"type": "string", "pattern": "^[0-9]+\\.[0-9]+\\.[0-9]+(-draft)?$"},
    "family": {"type": "string", "pattern": "^[a-z0-9][a-z0-9_]*$"},
    "title": {"type": "string", "minLength": 1},
    "jurisdiction": {"type": "string", "minLength": 1},
    "status": {"type": "string", "enum": ["discovered", "extracted_draft", "needs_review"]},
    "description": {"type": "string", "minLength": 1},
    "citations": {
      "type": "array",
      "minItems": 1,
      "items": {
        "type": "object",
        "additionalProperties": false,
        "required": ["snapshot_id", "section", "quote"],
        "properties": {
          "snapshot_id": {"type": "string", "minLength": 1},
          "section": {"type": "string", "minLength": 1},
          "quote": {"type": "string", "minLength": 1},
          "last_amended": {"type": ["string", "null"]},
          "content_digest_sha256": {"type": "string", "pattern": "^[0-9a-f]{64}$"}
        }
      }
    },
    "inputs": {
      "type": "array",
      "items": {
        "type": "object",
        "additionalProperties": false,
        "required": ["name", "type", "required"],
        "properties": {
          "name": {"type": "string", "pattern": "^[a-z0-9][a-z0-9_]*$"},
          "type": {"type": "string", "enum": ["string", "number", "integer", "boolean"]},
          "required": {"type": "boolean"},
          "unit": {"type": ["string", "null"]},
          "enum": {"type": "array", "items": {"type": "string"}},
          "description": {"type": "string"},
          "minimum": {"type": "number", "description": "M4-T003: optional inclusive lower bound for a numeric input; a supplied value below it is rejected fail-closed at evaluation (no computed value)."},
          "maximum": {"type": "number", "description": "M4-T003: optional inclusive upper bound for a numeric input."},
          "exclusive_minimum": {"type": "number", "description": "M4-T003: optional exclusive lower bound (value must be strictly greater); e.g. a zoning-lot area must be > 0."},
          "exclusive_maximum": {"type": "number", "description": "M4-T003: optional exclusive upper bound (value must be strictly less)."}
        }
      }
    },
    "outputs": {
      "type": "array",
      "minItems": 1,
      "items": {
        "type": "object",
        "additionalProperties": false,
        "required": ["name", "type"],
        "properties": {
          "name": {"type": "string", "pattern": "^[a-z0-9][a-z0-9_]*$"},
          "type": {"type": "string", "enum": ["number", "integer"]},
          "unit": {"type": ["string", "null"]},
          "description": {"type": "string"}
        }
      }
    },
    "parameters": {
      "type": "array",
      "items": {
        "type": "object",
        "additionalProperties": false,
        "required": ["name", "value", "citation_ref"],
        "properties": {
          "name": {"type": "string", "pattern": "^[a-z0-9][a-z0-9_]*$"},
          "value": {
            "description": "A scalar number, or a map (object) of key->number for district-keyed lookups via the param_select ref.",
            "type": ["number", "object"],
            "additionalProperties": {"type": "number"}
          },
          "citation_ref": {"type": "string", "minLength": 1},
          "note": {"type": "string"}
        }
      }
    },
    "applicability": {"$ref": "#/$defs/predicate"},
    "computation": {
      "type": "object",
      "additionalProperties": false,
      "required": ["steps", "outputs"],
      "properties": {
        "steps": {
          "type": "array",
          "minItems": 1,
          "items": {
            "type": "object",
            "additionalProperties": false,
            "required": ["id", "op", "args"],
            "properties": {
              "id": {"type": "string", "pattern": "^[a-z0-9][a-z0-9_]*$"},
              "op": {"type": "string", "enum": ["identity", "add", "subtract", "multiply", "divide", "min", "max", "round", "round_threshold", "clamp"], "description": "round_threshold (D-090 lane A item A-02b; args [value, threshold]): the whole number of value, plus one only when its fractional part is at least threshold; value >= 0 and 0 < threshold <= 1, else fail-closed. Additive: round keeps its half-away-from-zero behaviour."},
              "args": {"type": "array", "minItems": 1, "items": {"$ref": "#/$defs/ref"}},
              "note": {"type": "string"}
            }
          }
        },
        "outputs": {
          "type": "object",
          "minProperties": 1,
          "additionalProperties": {
            "type": "object",
            "additionalProperties": false,
            "required": ["step"],
            "properties": {"step": {"type": "string"}}
          }
        }
      }
    },
    "exceptions": {
      "type": "array",
      "items": {
        "type": "object",
        "additionalProperties": false,
        "required": ["id", "description", "effect"],
        "properties": {
          "id": {"type": "string", "minLength": 1},
          "description": {"type": "string", "minLength": 1},
          "condition": {"anyOf": [{"$ref": "#/$defs/predicate"}, {"type": "null"}]},
          "effect": {"type": "string", "enum": ["conditional_alternative", "professional_review_required", "documented_limitation"]},
          "citation_ref": {"type": ["string", "null"]},
          "note": {"type": "string"}
        }
      }
    },
    "special_district_interactions": {
      "type": "array",
      "items": {
        "type": "object",
        "additionalProperties": false,
        "required": ["id", "description"],
        "properties": {
          "id": {"type": "string", "minLength": 1},
          "description": {"type": "string", "minLength": 1},
          "interaction_point": {"type": "string"},
          "special_rule_stub": {"type": ["string", "null"]},
          "citation_ref": {"type": ["string", "null"]}
        }
      }
    },
    "uncertainty_policy": {
      "type": "object",
      "additionalProperties": false,
      "properties": {
        "geometry_uncertain_coverage": {"type": "string", "enum": ["professional_review_required", "conditional"]},
        "data_conflict_coverage": {"type": "string", "enum": ["data_conflict"]},
        "note": {"type": "string"}
      }
    },
    "limitations": {"type": "array", "items": {"type": "string"}},
    "effective_from": {
      "type": ["string", "null"],
      "pattern": "^[0-9]{4}-[0-9]{2}-[0-9]{2}$",
      "description": "M4-T003: ISO date (YYYY-MM-DD) this rule version first takes effect, or null for open-ended-in-the-past. Used with an as_of evaluation date to select the version in effect. Half-open with effective_to: [effective_from, effective_to)."
    },
    "effective_to": {
      "type": ["string", "null"],
      "pattern": "^[0-9]{4}-[0-9]{2}-[0-9]{2}$",
      "description": "M4-T003: ISO date this rule version stops being effective (exclusive), or null for open-ended-in-the-future."
    },
    "release": {
      "type": "object",
      "additionalProperties": false,
      "description": "M4-T003: self-described test/lifecycle release evidence carried into the trace so a consumer sees, per evaluation, that a draft rule is not release-verified. Never a substitute for the independent gate or G6.",
      "properties": {
        "deterministic_tests": {"type": "string", "enum": ["declared", "none"], "description": "Whether the rule author declares a deterministic test suite exercises this rule."},
        "test_suite_ref": {"type": ["string", "null"], "description": "Pointer to the deterministic test evidence (e.g. a test module path)."},
        "independent_review": {"type": "string", "enum": ["pending", "passed"], "description": "Independent engineering review (G3/G4) state as declared by the rule author; the authoritative record is the project-control ledger."},
        "qualified_human_approval": {"type": "string", "enum": ["pending", "approved"], "description": "G6 qualified-human legal approval state. 'approved' is meaningful only alongside a recorded G6Approval at evaluation time; a draft rule declares 'pending'."}
      }
    },
    "determination": {
      "$ref": "#/$defs/determination",
      "description": "M4-T003: optional compliance determination. When present, after the computation the engine compares a proposal input against a computed output (or constant) and records a genuine pass/fail determination in the trace WITHOUT changing coverage (a draft rule stays conditional)."
    },
    "lane_flag": {
      "type": "string",
      "enum": ["A", "B", "C", "D", "E"],
      "description": "D-090 (lane A item A-02a): optional parallel-build lane that owns this rule while it is new behavior. The registry VALIDATES the rule at every load like any other, but INDEXES it (makes it visible to evaluation, families and every consumer) only when that lane's flag LANE_<X>_ENABLED holds an explicit true token; absent/empty/unknown = off (fail safe). Absent field = always indexed (every rule written before D-090)."
    }
  },
  "$defs": {
    "determination": {
      "type": "object",
      "additionalProperties": false,
      "required": ["id", "left", "compare", "right", "pass_label", "fail_label"],
      "properties": {
        "id": {"type": "string", "pattern": "^[a-z0-9][a-z0-9_]*$"},
        "description": {"type": "string"},
        "left": {"$ref": "#/$defs/determination_ref"},
        "compare": {"type": "string", "enum": ["lt", "le", "gt", "ge", "eq", "ne"]},
        "right": {"$ref": "#/$defs/determination_ref"},
        "pass_label": {"type": "string", "minLength": 1},
        "fail_label": {"type": "string", "minLength": 1},
        "citation_ref": {"type": ["string", "null"]}
      }
    },
    "determination_ref": {
      "type": "object",
      "additionalProperties": false,
      "description": "Exactly one of const / input / output. 'output' references a declared computation output by name (available after computation).",
      "properties": {
        "const": {"type": "number"},
        "input": {"type": "string"},
        "output": {"type": "string"}
      }
    },
    "ref": {
      "type": "object",
      "additionalProperties": false,
      "properties": {
        "const": {"type": "number"},
        "input": {"type": "string"},
        "param": {"type": "string"},
        "param_select": {
          "type": "object",
          "additionalProperties": false,
          "required": ["map", "key_input"],
          "properties": {
            "map": {"type": "string"},
            "key_input": {"type": "string"}
          }
        },
        "step": {"type": "string"}
      }
    },
    "predicate": {
      "type": "object",
      "properties": {
        "op": {"type": "string", "enum": ["equals", "in_set", "exists", "compare"]},
        "input": {"type": "string"},
        "value": {},
        "values": {"type": "array"},
        "compare": {"type": "string", "enum": ["lt", "le", "gt", "ge", "eq", "ne"]},
        "all": {"type": "array", "items": {"$ref": "#/$defs/predicate"}, "minItems": 1},
        "any": {"type": "array", "items": {"$ref": "#/$defs/predicate"}, "minItems": 1},
        "not": {"$ref": "#/$defs/predicate"}
      }
    }
  }
}
